[
    {
        "library": "Bibliothèque nationale de France",
        "nation": "France",
        "city": "Paris",
        "website": "https://gallica.bnf.fr/",
        "iiif": true,
        "is_free_cultural_works_license": true,
        "quantity": "Thousands"
    },
    {
        "library": "The British Library",
        "nation": "United Kingdom",
        "city": "London",
        "website": "https://www.bl.uk/manuscripts/",
        "iiif": true,
        "is_free_cultural_works_license": false,
        "quantity": "Thousands"
    },
    {
        "library": "Biblioteca Apostolica Vaticana",
        "nation": "Vatican City",
        "city": "Vatican City",
        "website": "https://digi.vatlib.it/",
        "iiif": true,
        "is_free_cultural_works_license": false,
        "quantity": "Hundreds"
    },
    {
        "library": "Österreichische Nationalbibliothek",
        "nation": "Austria",
        "city": "Vienna",
        "website": "https://digital.onb.ac.at/",
        "iiif": false,
        "is_free_cultural_works_license": true,
        "quantity": "Dozens"
    },
    {
        "library": "Koninklijke Bibliotheek",
        "nation": "Netherlands",
        "city": "The Hague",
        "website": "https://www.kb.nl/",
        "iiif": false,
        "is_free_cultural_works_license": false,
        "quantity": "Few"
    }
]
